{"proyecto":"E:\\MY\\_TOOLS\\socarrandin-skills-ecosysem\\architecture-clone-plugins\\tests\\fixture\\proyecto-prueba","nombre":"proyecto-prueba","paso":"analyze","fecha":"2026-08-13T10:00:00Z","resumen":"E:\\MY\\_TOOLS\\socarrandin-skills-ecosysem\\architecture-clone-plugins\\tests\\fixture\\proyecto-prueba\\.architecture-clone\\architecture-summary.md"}
